{"id":"effect.title","name":"Title text","version":"1.0.0","category":"Títulos y gráficos","type":"effect","description":"Burn-in title (drawtext)","params":{"text":{"type":"string","default":"Title"},"fontsize":{"type":"number","default":48,"min":12,"max":200}},"ffmpeg":{"filter":"drawtext=text='{text}':fontsize={fontsize}:fontcolor=white:x=(w-text_w)/2:y=h*0.08:box=1:boxcolor=black@0.4"},"license":"MIT-compatible (FFmpeg)"}
